{
  "schema": "monster@1.0",
  "id": "m.village.wolf_01",
  "name": "txt.monster.village_wolf.name",
  "desc": "txt.monster.village_wolf.desc",
  "tier": "normal",
  "level": 2,
  "stats": {
    "hp": 28,
    "atk": 7,
    "def": 2,
    "agi": 4
  },
  "rewards": {
    "exp": 14,
    "gold": {
      "min": 6,
      "max": 10
    }
  },
  "drops": {
    "entries": [
      {
        "item_id": "wolf_pelt",
        "weight": 100,
        "qty": {
          "min": 1,
          "max": 1
        }
      }
    ]
  },
  "$schema": "02_specs/schema/monster.schema.json"
}
